user_id,created_at,hashtags,retweet_count,favorite_count,user_name,user_friends_count,user_followers_count,user_location,user_tweet_count,place,geo,happiness_index,tweets
8.44E+17,2017/11/16 22:01,[],0,1,Ali Gencer .,439,501,"Los Angeles, CA",28998,None,None,-2,"@IranNewsroom saudi,is not a country,Muslim never!it was state of uk,now it has changed hands to usa!royal family a‚Ä?https://t.co/0jThca9gs7"
161056941,2017/11/16 21:28,[],0,0,Eugene Harris,247,325,"LOS ANGELES, CA",645,None,None,-1,"Well ain't this some shit.
I'm not Alex Jones or a conspiracy guy but something doesn't adds up with this Domestic‚Ä?https://t.co/Swrp1ZO3VE"
8.16E+17,2017/11/16 20:45,[],0,0,Bruce Baldwin,1858,579,"Los Angeles, CA",12315,None,None,-2,"@FuzzyWuzzyTO Fuzzy, you sweet gay terrorist, exactly what is it that you don't understand about pizza? Do we need‚Ä?https://t.co/qnQEYYgPc0"
60815392,2017/11/16 20:44,[],0,0,Buddahfan,319,656,Los Angeles,146376,None,None,-2,"One terrorist group out and another one moves in. 

Iran moves into Syria to fill terrorist void left by weakened I‚Ä?https://t.co/HnkmgiBxwj"
9.18E+17,2017/11/16 20:35,[],0,0,"Tara Chand Esq., Founder & CEO of IPG Inc.",972,4,"Los Angeles, CA",19,None,None,0,"""Tara Chand Esq., CEO IPG Inc., Writes to President Trump Identifying Root Causes of ISIS &amp; Other Types of Recent Terrorist Attacks"""
14792082,2017/11/16 20:18,"[u'terrorist', u'LloydBlankfein', u'Brexit']",0,1,Jeffrey Gold,697,468,"Los Angeles, CA",4187,None,None,-1,Why is anyone listening to the domestic economic #terrorist @lloydblankfein #LloydBlankfein about a second #Brexit‚Ä?https://t.co/dWHcagEQJN
17528812,2017/11/16 20:12,[],0,3,Jim Coughlin,1810,1602,"Los Angeles, California, USA",6915,"Place(_api=<tweepy.api.API object at 0x000000000DEAF550>, full_name=u'Los Angeles, CA', url=u'https://api.twitter.com/1.1/geo/id/3b77caf94bfc81fe.json', country=u'United States', place_type=u'city', bounding_box=BoundingBox(_api=<tweepy.api.API object at 0x000000000DEAF550>, type=u'Polygon', coordinates=[[[-118.668404, 33.704538], [-118.155409, 33.704538], [-118.155409, 34.337041], [-118.668404, 34.337041]]]), contained_within=[], country_code=u'US', attributes={}, id=u'3b77caf94bfc81fe', name=u'Los Angeles')",None,-2,"If any terrorist organizations want to destroy America, they could do worse than to study the techniques of the Republican Party."
262385174,2017/11/16 19:41,[],1,2,Jason Shaffer,234,100,"Los Angeles, CA",3932,None,None,-2,Unfortunately there isn't anyway to hide the fact that he is a disgusting and shameful sub human being. It's true.‚Ä?https://t.co/VdjhH0lRjh
15387404,2017/11/16 19:20,[],0,0,JayRnLa,1038,648,Los Angeles,5618,None,None,-2,@realDonaldTrump WTF do you care?  You‚Äôre trying to kill all of us with your shit healthcare and tax reform.  What‚Äô‚Ä?https://t.co/Bk0nehtWwb
36497764,2017/11/16 19:00,[],0,1,Kiera,497,363,"Los Angeles, CA",2379,None,None,-2,This is getting ridiculous. All of my news alerts are either new sexual harassment allegations or new terrorist sho‚Ä?https://t.co/UMnlGL1wrG
2519580234,2017/11/16 18:57,[],0,0,Climate Change 911,4406,4870,"Los Angeles, CA",6276,None,None,-1,Climate Change and Water Woes Drove ISIS Recruiting in Iraq https://t.co/TLz3VAD14E
8.89E+17,2017/11/16 18:42,[],0,0,TMZMETS,403,279,"Hollywood, Los Angeles",12900,None,None,-1,@usblm where‚Äôs your poll terrorist?
542292712,2017/11/16 16:38,[],0,0,#doobieworld,861,2487,"Los Angeles, CA",250010,None,None,-2,I used to hate getting off on CMT in high school smh. Them niggas was terrorist back then üòÇüòÇüòÇüòÇ
7.24E+17,2017/11/16 16:15,[],4,6,Corinne Buckley,11933,12396,"Beverly Hills, CA",10403,None,None,-2,Terrorist linda Sarsour gets honor for praising terror against Potus and violence against women . What is wrong wit‚Ä?https://t.co/RiYpZbNdy8
50050607,2017/11/16 16:01,[],0,0,Howard Hoffenberg,192,200,Los Angeles (Brentwood),1089,None,None,-2,Write representatives to amend Communications Decency Act to add notice and take down procedures for terrorist cont‚Ä?https://t.co/5Vc9uR0uL4
579893506,2017/11/16 15:30,[],0,0,Higher Education,4004,3816,"Burbank, California",21264,None,None,-2,"Terrorist-sympathizer speaks at George Washington University, calls Zionists 'McCarthyites' - Washington Examiner https://t.co/rbJ3PyHwj9"
9.23E+17,2017/11/16 15:28,[],0,0,Eric Czarnopys,137,28,"Venice, CA",159,None,None,1,"Crisp CEO believes we can beat online hate speech, terrorist content, and fake news https://t.co/smcYxT1RMh https://t.co/14hC4tyPyH"
2959209469,2017/11/16 15:03,[],0,0,MADDCAL,4500,3676,"Los Angeles, CA",13738,None,None,0,"Bannon Turns Down Lunch With Foreign Leader, Refused &amp;#8216;To Breathe the Same Air as a Terrorist&amp;#8217; https://t.co/2QaFzdl93i"
187578616,2017/11/16 14:47,[],21,23,David Horowitz,560,47843,"Los Angeles, Ca",7336,None,None,-1,"A terrorist group on 200 U.S. campuses, supported by the entire campus left: https://t.co/5F8UsjgbAw"
4593611713,2017/11/16 13:04,[],0,0,OLRM,133,19,"Los Angeles, CA",552,None,None,1,"Crisp CEO believes we can beat online hate speech, terrorist content, and fake news https://t.co/e5zX73tQ5G"
4593611713,2017/11/16 12:54,[],0,0,OLRM,133,19,"Los Angeles, CA",552,None,None,1,"Crisp CEO believes we can beat online hate speech, terrorist content, and fake news https://t.co/6HvGHATO6Z https://t.co/Xiswn18JNH"
4593611713,2017/11/16 12:21,[],0,0,OLRM,133,19,"Los Angeles, CA",552,None,None,1,"Crisp CEO believes we can beat online hate speech, terrorist content, and fake news https://t.co/TUCsE2y5qP https://t.co/MJFYt1dV5t"
24621432,2017/11/16 10:09,[],0,0,Heather Kenyon,657,620,"Los Angeles, CA",1809,None,None,-2,"I released 2,000 minks from a fur farm. Now I'm a convicted terrorist | Kevin Johnson https://t.co/OfP96AuioV"
4426244834,2017/11/16 9:47,[],0,0,garlic toasties,190,72,LA,785,None,None,-2,@Viqingur @amnesty what does that have to do with the race of the vast majority of terrorist attackers in Europe? Ur self hatred is suicidal
63202029,2017/11/16 6:45,[],0,0,zoli osaze,4114,3612,los angeles,165392,None,None,-2,another white terrorist ..... a known nutjob .... more white privilege ..... the NRA .... and the GOP costing innoc‚Ä?https://t.co/a1rufRHebk
565843310,2017/11/16 6:23,[],0,1,hollywood,186,246,"Burbank, CA",9869,None,None,-2,@LeftSentThis White terrorist trump supporter
357965868,2017/11/16 6:12,[u'TrumpIsAMoron'],0,0,schottzie78,2676,98,Los Angeles,479,None,None,-2,"@realDonaldTrump @PressSec @GOP 

So many domestic terrorist attacks you can‚Äôt keep them straight. #TrumpIsAMoron‚Ä?https://t.co/ed3v3jzNUz"
2680615508,2017/11/16 5:18,[],0,0,The Majors LA,201,219,"Los Angeles, CA",48035,None,None,0,"Bianca Campbell enlisted in the U.S. Army two days after the terrorist attacks of Sept. 11, 2001. The timing was... https://t.co/svCoHng8Un"
2869945663,2017/11/16 5:09,[],0,0,dilly dilly,690,783,"Los Angeles, CA",25070,None,None,-1,The ivory trade literally funds terrorist groups. https://t.co/mb5esx6CxL
8.24E+17,2017/11/16 4:39,[],0,0,Khalev Ramirez,670,59,"Los Angeles, CA",464,None,None,-2,Send your Lawyer to jail for conspiring to terrorist acts via fraud. Via retaliation! Send his ass to county for 8 months like he sent me
774024776,2017/11/16 4:22,[],0,0,Julie Dufour,2051,1126,"Los Angeles, California",13247,None,None,2,I love to see @SteveScalise looking so well. Thank God The domestic terrorist failed. https://t.co/DwVS7eFJpq
2734998494,2017/11/16 4:11,[],1,1,Dean Mohamed,4999,2339,"Los Angeles, CA",8787,None,None,-2,"CIA, MI6 and Mossad are behind ISIS and other terrorist activities, backed by pro govt media!!!! https://t.co/N8Ql0f8q7U"
9.24E+17,2017/11/16 3:03,[],0,0,Dawnalexus,45,26,"Inglewood, CA",101,None,None,-2,@Hunitproof can u pls take ur terrorist looking ass back wdf u came from we dnt need the neg bullshit over her boo and I‚Äôm being hella nice
20008659,2017/11/16 2:13,[],2,4,Melissa Schwartz,327,694,Los Angeles,4642,None,None,-2,"""Put succinctly, I am a terrorist not because of what I did, but because the government dislikes why I did it."" https://t.co/BLPrqkAXNs"
447021141,2017/11/16 1:47,[u'TheTrueFaceOfTerrorismEuropeans'],0,1,Kristina Knight,57,146,Beverly Hills CA,4540,None,None,-2,#TheTrueFaceOfTerrorismEuropeans This scum bag just shot up a children's elementary school in northern California k‚Ä?https://t.co/ijGu0EoKVn
223930293,2017/11/16 1:18,[],1,0,dancerette,2426,1407,los angeles,33189,None,None,-2,How Can The U.S. Allow Terrorist Organizations Who Are Now In The Nation And Paying For Assaults On Americans GO UN‚Ä?https://t.co/Gu7sit0wQ7
399129934,2017/11/16 0:34,"[u'terrorist', u'white', u'Vegas', u'Texas', u'mummy', u'MitchMcConell']",1,1,Tommy Garrett,4144,2320,Beverly Hills,46422,"Place(_api=<tweepy.api.API object at 0x000000000DEAF550>, full_name=u'Beverly Hills, CA', url=u'https://api.twitter.com/1.1/geo/id/741e9df4d2522275.json', country=u'United States', place_type=u'city', bounding_box=BoundingBox(_api=<tweepy.api.API object at 0x000000000DEAF550>, type=u'Polygon', coordinates=[[[-118.4273439, 34.052559], [-118.371934, 34.052559], [-118.371934, 34.112434], [-118.4273439, 34.112434]]]), contained_within=[], country_code=u'US', attributes={}, id=u'741e9df4d2522275', name=u'Beverly Hills')",None,-2,If a #terrorist is #white (#Vegas #Texas) Tramp has nothing to tweet or say. And now #mummy #MitchMcConell) wants T‚Ä?https://t.co/pfFhhkbxia
3039681304,2017/11/16 0:31,[u'Scientology'],0,1,Jeffrey Augustine,852,4349,"Los Feliz, CA",1165,None,None,-1,"@nacafoil #Scientology is a psycho-terrorist organization awash in strange suicides, deaths, destroying families, f‚Ä?https://t.co/SS7OjQH990"
4835593824,2017/11/15 23:18,[],3,7,Currie Dobson,1732,2272,"Los Angeles, CA",57723,None,None,-1,"@dannythetrucker Who said I was a Bernie supporter anymore? He lost me when he didn't speak up about being cheated,‚Ä?https://t.co/BIbPO05OFJ"
334371998,2017/11/15 23:17,[],0,3,Anastacia,391,356,Chicago and Los Angeles,22811,None,None,-2,"Like, lady, I can assure you that she is not a terrorist, but you, I'm sure, are a real bitch!"
334371998,2017/11/15 23:16,[],0,1,Anastacia,391,356,Chicago and Los Angeles,22811,None,None,-2,"Haha I hate racists. 
The bakery attendant a Jewel was wearing a hijab and because of this, the lady after me at th‚Ä?https://t.co/1PMntTk7t3"
6603812,2017/11/15 23:00,[],2,1,USC Public Diplomacy,989,11669,"Los Angeles, CA",28208,None,None,0,"In his new book, ""As Terrorism Evolves,"" @PhilipSeib says terrorist prospects are ""so unhappy with their lives for‚Ä?https://t.co/MKkQPAs3QE"
8.89E+17,2017/11/15 21:55,[],1,2,TMZMETS,403,279,"Hollywood, Los Angeles",12901,None,None,-2,@usblm @bronxilla @realDonaldTrump BLM is a terrorist organization.
25324003,2017/11/15 20:28,[],0,0,Darlene,216,92,Where else but Los Angeles!!!,3982,None,None,-2,"What‚Äôs sad is this POS will be labeled as mentally ill instead of what he really is, a damn terrorist.   Body of No‚Ä?https://t.co/oktHEENIZl"
3289411020,2017/11/15 20:22,[],0,0,Brandyfornia,279,381,"Los Angeles, CA",9956,None,None,-2,That nigga was probably the real terrorist ü§¶üèΩ‚Äç‚ôÄÔ∏?https://t.co/Xpow3C36KQ
45213222,2017/11/15 20:19,[],4,5,SAVIORSELF,419,667,"SAN DIEGO (NATIONAL CITY), CA",17908,"Place(_api=<tweepy.api.API object at 0x000000000DEAF550>, full_name=u'Los Angeles, CA', url=u'https://api.twitter.com/1.1/geo/id/3b77caf94bfc81fe.json', country=u'United States', place_type=u'city', bounding_box=BoundingBox(_api=<tweepy.api.API object at 0x000000000DEAF550>, type=u'Polygon', coordinates=[[[-118.668404, 33.704538], [-118.155409, 33.704538], [-118.155409, 34.337041], [-118.668404, 34.337041]]]), contained_within=[], country_code=u'US', attributes={}, id=u'3b77caf94bfc81fe', name=u'Los Angeles')",None,-2,If this is the definition of ‚Äúterrorist‚Ä?then we can all agree that the USA was created thru terrorism. https://t.co/5mZBDpcG2m
16022929,2017/11/15 20:00,[],0,1,"Corey ""Get Rid Of The Nazis On Here"" Rittmaster",737,806,"Los Angeles, CA",10603,None,None,-2,The @NRA doesn‚Äôt even represent NRA members. They‚Äôre a terrorist organization. https://t.co/XDgjamAiek
8.46E+17,2017/11/15 19:56,[],0,0,P.L.Brown,112,17,"Los Angeles, CA",38,None,None,-2,How many times will the political terrorist republican party try to kills americans with their stupid ideas. I don'‚Ä?https://t.co/1wl1Yaw4xt
2321628775,2017/11/15 19:27,[],0,0,I'm So Tired,199,72,Los Angeles,332,None,None,-2,"@michaelianblack Love this. Please keep it up. ""The NRA is a terrorist organization"" whose immoral lobbying and pol‚Ä?https://t.co/ZdvKZ6siXi"
314292109,2017/11/15 19:26,[],0,1,Clipsluv,961,1057,"Los Angeles, CA",132453,None,None,-2,Of course the terrorist that shot up a school in Northern California is a white male...that's why the right has onl‚Ä?https://t.co/Krbk4icIBG
37255542,2017/11/15 18:49,[],0,0,Owen Conway,1280,341,"Los Angeles, CA",1825,None,None,-2,"PETA is a terrorist cabal who kidnap and murder pets. If you love animals, don't support these monsters‚Ä?https://t.co/xx7uDJLiko"
37255542,2017/11/15 18:48,[],0,2,Owen Conway,1280,341,"Los Angeles, CA",1825,None,None,-2,@katystoll @cracked PETA is a terrorist organization. Good on you guys for calling out these murderers
170956028,2017/11/15 18:30,[],0,0,A l e x,692,1160,"Los Angeles, CA",17742,None,None,-2,I nearly had a panic attack during a scheduled fire drill at work. I couldn‚Äôt help but think of 9/11 or a shooting.‚Ä?https://t.co/Nvgm9bDH4D
45681041,2017/11/15 18:15,[],1,20,Vertigo Comics,144,182272,"Burbank, CA",5436,None,None,-1,They used to be allies who fought side by side. Now Jason has to track down Amber Waves for her terrorist crimes in‚Ä?https://t.co/UMJvSd3pNO
8.63E+17,2017/11/15 18:07,"[u'terrorist', u'Terrorism', u'RanchoTehama', u'northerncaliforniashooting', u'TrumpRussia', u'anyonecanbeaterrorist']",0,0,Lay C. Front,104,48,"Los Angeles, CA",137,None,None,-2,Sounds like a #terrorist #Terrorism to me. #RanchoTehama #northerncaliforniashooting #TrumpRussia #anyonecanbeaterrorist
8.97E+17,2017/11/15 17:37,[],0,0,Kevin of the Right,16,8,"Los Angeles, CA",311,None,None,-2,"@titostiles @erieboatr @FoxNews He‚Äôs an illegal immigrant and and terrorist, why are you defending him?"
12863902,2017/11/15 17:07,[],0,0,Michael,3477,1422,"Los Angeles, CA",5576,None,None,-2,@dlivingstone @CarlaJM @x24sonic @Luvvie @Twitter How many terrorist attacks have happened in Poland the last few years?
8.94E+17,2017/11/15 16:58,[],0,0,Dank Savage Memes,474,78,"Los Angeles, CA",1339,None,None,-2,"@AustineOBrian @washingtonpost Why do u even care if someone is called a terrorist, thug, or mentally ill? It doesn‚Ä?https://t.co/tqUthX1eWg"
308680790,2017/11/15 16:32,[],0,3,earl ramsey,501,656,South central los Angeles ....,12896,"Place(_api=<tweepy.api.API object at 0x000000000DEAF550>, full_name=u'Los Angeles, CA', url=u'https://api.twitter.com/1.1/geo/id/3b77caf94bfc81fe.json', country=u'United States', place_type=u'city', bounding_box=BoundingBox(_api=<tweepy.api.API object at 0x000000000DEAF550>, type=u'Polygon', coordinates=[[[-118.668404, 33.704538], [-118.155409, 33.704538], [-118.155409, 34.337041], [-118.668404, 34.337041]]]), contained_within=[], country_code=u'US', attributes={}, id=u'3b77caf94bfc81fe', name=u'Los Angeles')",None,-1,"Glad to see so many ppl live the ""PERFECT"" life ... I can't relate 
.. I've made plenty mistakes .. especially at a‚Ä?https://t.co/K2En8Fw4XP"
3215256993,2017/11/15 16:17,[],1,12,Kazeem Rahman,34128,55141,"Los Angeles, CA",4996,None,None,-1,Forget a terrorist. I just don't want to have to sit next to this crying baby on this plane.
25836560,2017/11/15 16:11,[],0,0,Steven Entezari,245,550,"Los Angeles, CA",9951,"Place(_api=<tweepy.api.API object at 0x000000000DEAF550>, full_name=u'Los Angeles, CA', url=u'https://api.twitter.com/1.1/geo/id/3b77caf94bfc81fe.json', country=u'United States', place_type=u'city', bounding_box=BoundingBox(_api=<tweepy.api.API object at 0x000000000DEAF550>, type=u'Polygon', coordinates=[[[-118.668404, 33.704538], [-118.155409, 33.704538], [-118.155409, 34.337041], [-118.668404, 34.337041]]]), contained_within=[], country_code=u'US', attributes={}, id=u'3b77caf94bfc81fe', name=u'Los Angeles')",None,-1,"‚ÄúYour dream is like a child ... and when someone binds up your dream, and holds a gun to its head ... it‚Äôs a hostag‚Ä?https://t.co/YXEHh3jc8K"
50050607,2017/11/15 16:06,[],0,0,Howard Hoffenberg,192,200,Los Angeles (Brentwood),1089,None,None,0,Rep Doris Matsui (D-Ca) on Digital Commerce &amp; Consumer Protection Subcommittee asked to sponsor the Brand Encroachm‚Ä?https://t.co/pF1k2wmm3w
50050607,2017/11/15 16:04,[],0,0,Howard Hoffenberg,192,200,Los Angeles (Brentwood),1089,None,None,0,Representative Doris Matsi (D-Ca) asked to sponsor the Brand  Encroachment Terrorist Teaching Extremism Restrained‚Ä?https://t.co/coYWsxTlaL
213833809,2017/11/15 14:51,[],4,4,Patty Shenker,1253,1429,"Los Angeles, Ca. USA",23041,None,None,-1,"I released 2,000 minks from a fur farm. Now I'm a convicted terrorist | Kevin Johnson https://t.co/VC0QR64ta2"
86659367,2017/11/15 14:29,[],4,9,TheDevilisRepublican,5197,5669,"Los Angeles, CA",2769,None,None,-2,Another Republican terrorist with a gun in Tehama County https://t.co/7aMhDqEzLW
774024776,2017/11/15 14:01,[u'Obama'],1,5,Julie Dufour,2051,1126,"Los Angeles, California",13247,None,None,-2,"@RitaPanahi #Obama/ClintonCabal is responsible for emergence of slave trade,arming AQ,ISIS and deaths of American S‚Ä?https://t.co/8gRxkD2BLj"
9.04E+17,2017/11/15 11:08,[],0,0,"China,like hell",11,164,"Los Angeles, CA",563,None,None,-2,"National terrorist raised by CCP. They have full immunity ,license to kill,out of jail card...https://t.co/UAd2pTNmLn"
8.59E+17,2017/11/15 10:37,[],0,0,FairHousingSFV,67,39,"Panorama City, CA",3557,None,None,-1,"'Visa Lottery' Brought in 30,000 People from Terror-Funding Nations Since 2007 https://t.co/7khjuVczQ3"
4387152556,2017/11/15 10:29,[],0,0,(((gator))),186,71,,5283,"Place(_api=<tweepy.api.API object at 0x000000000DEAF550>, full_name=u'Los Angeles, CA', url=u'https://api.twitter.com/1.1/geo/id/3b77caf94bfc81fe.json', country=u'United States', place_type=u'city', bounding_box=BoundingBox(_api=<tweepy.api.API object at 0x000000000DEAF550>, type=u'Polygon', coordinates=[[[-118.668404, 33.704538], [-118.155409, 33.704538], [-118.155409, 34.337041], [-118.668404, 34.337041]]]), contained_within=[], country_code=u'US', attributes={}, id=u'3b77caf94bfc81fe', name=u'Los Angeles')",None,-2,@warriorsworld @deray Undoubtedly the media treats POC perpetrators of violence differently than white ones. But te‚Ä?https://t.co/kk3XGxymUd
2963780327,2017/11/15 9:47,[],0,0,ihateeveryonesodonttalktomeyouuglyasslosers,197,983,"Los Angeles, CA",367,None,None,-1,But yettttttttttttttt they think they can stop the terrorist from coming in by banning all Muslims lmao https://t.co/3jo9HEWKXs
398803539,2017/11/15 8:50,[],0,4,Kelly ritter,2103,308,"Manhattan Beach, California",2910,None,None,-2,"@rezaaslan Since the election, he's had a hard time saying ""California."" Today's mass shooting was in California, T‚Ä?https://t.co/Oy62ZWJizI"
287286991,2017/11/15 8:40,[],0,4,awaken,823,508,los angeles,7957,None,None,-2,@ABC7 Another white terrorist
2964182437,2017/11/15 7:51,[],0,0,Patrick,2,36,"Hawthorne,California",2009,None,None,0,How to Survive an Active Shooter or Terrorist Attack - Animation https://t.co/bPjXxSHiEy via @YouTube
16190062,2017/11/15 6:50,[],0,0,James Sloat,2420,583,Los Angeles,5758,None,None,-2,@drewharris102 @mmpadellan The only reason I have weapons is for Nazi terrorist republicansa
2468733193,2017/11/15 6:49,[],0,0,Eli Cash,140,139,"Los Angeles, CA",3940,None,None,-2,How sick is this person? Linda groups Zionists with white supremacists and praises Louis Farrakhan and terrorist mu‚Ä?https://t.co/TPqZxsqZJi
16190062,2017/11/15 4:36,[],0,0,James Sloat,2420,583,Los Angeles,5758,None,None,-2,"@Jim_Jordan is a fucking Nazi terrorist who, just like his brother @GOP Nazis, waged a very, very bloody civil war.‚Ä?https://t.co/7yi0pyCAVX"
31030518,2017/11/15 3:17,[],0,1,Heather Api,756,216,"Los Angeles, CA",5258,None,None,-2,Getting the NRA is a fucking terrorist organization tattooed on my forehead. May leave out the fucking part.
354456001,2017/11/15 3:10,[],4,13,Lion Hunter Music,1942,579,"Los Angeles, CA",10151,None,None,-2,@JamesGleick @NRA + @GOP triumphs. America now accepts any &amp; all NRA sponsored weapons of mass murder in the hands‚Ä?https://t.co/PCeNAQKj82
26872143,2017/11/15 2:06,[],0,0,@Jack is a Nazi,1064,272,"Los Angeles, CA",37537,None,None,-2,Gerard Butler is lecturing this terrorist about how America will live on no matter what and how terrorists don't un‚Ä?https://t.co/Iae1gmcB0U
114396174,2017/11/15 1:23,[],0,0,Electrowave,682,530,Los Angeles California ,10420,None,None,-2,@FoxNews Who Is The Real Terrorist ? -The U.S. Government's  X  &gt; &gt;&gt; https://t.co/brjgJPD0lt
28915949,2017/11/15 0:40,[],0,0,Roy A. Teel Jr.,1211,937,"Los Angeles, CA",9315,None,None,-2,"WOW I saw this coming in 2013, Hussein Obama the American terrorist President. https://t.co/902YrlH4fr"
870631664,2017/11/15 0:33,[],0,0,Jose Viesca,77,446,"Los Angeles, California",24442,None,None,-2,@AlfredoJalifeR_ This only confirms that the US government is a terrorist organization above international law. EUA is the worldwide ISIS
870631664,2017/11/15 0:30,[],1,0,Jose Viesca,77,446,"Los Angeles, California",24442,None,None,-2,"@AlfredoJalifeR_ EXPLOSIVE: BBC admits US ‚Äúcoalition‚Ä?working with ISIS, providing safe passage to terrorist fighte‚Ä?https://t.co/NGXOk1pwGW"
114396174,2017/11/15 0:26,[],0,0,Electrowave,682,530,Los Angeles California ,10420,None,None,-2,"@FoxNews @SpeakerRyan Stop your terrorist USA activities in Iraq, Syria, Yemen, North Korea. Or suffer the consequences. No more warning."
212568464,2017/11/15 0:15,[],4,6,Charles Marlowe,1282,10560,"Santa Monica, CA",18551,None,None,-2,Read this. Trump Admin says 6 other terrorist immigrants were imported to the US through the ‚Äúdiversity visa‚Ä?progr‚Ä?https://t.co/1Hho8AKS1w
114396174,2017/11/15 0:11,[],0,0,Electrowave,682,530,Los Angeles California ,10420,None,None,-2,@petty1983 @FoxNews Take your own advise USA terrorist. Keep believing in the fake news.
9.04E+17,2017/11/14 23:53,[],0,0,"China,like hell",11,164,"Los Angeles, CA",563,None,None,-2,I d say CCP is the largest terrorist group on the face of the world.
44714333,2017/11/14 23:28,[],0,1,(((merida montero))),5858,5405,"Burbank,ca",124328,None,None,-2,"@AP But White guy not a terrorist. Trump not ""made aware of situation"" and no Trump tweet. This isn't normal America."
288407048,2017/11/14 23:14,[],0,1,manny,2053,1647,LA monster for life!! ,110745,"Place(_api=<tweepy.api.API object at 0x000000000DEAF550>, full_name=u'Los Angeles, CA', url=u'https://api.twitter.com/1.1/geo/id/3b77caf94bfc81fe.json', country=u'United States', place_type=u'city', bounding_box=BoundingBox(_api=<tweepy.api.API object at 0x000000000DEAF550>, type=u'Polygon', coordinates=[[[-118.668404, 33.704538], [-118.155409, 33.704538], [-118.155409, 34.337041], [-118.668404, 34.337041]]]), contained_within=[], country_code=u'US', attributes={}, id=u'3b77caf94bfc81fe', name=u'Los Angeles')",None,-2,@ShealyAllison @CNN says the person supporting a terrorist.
38033555,2017/11/14 23:14,[],0,0,TedTheAtheist,169,517,Los Angeles,6230,None,None,-1,"@RaniaPunk I didn't say YOU were a terrorist in any way. I said that your religion, like others, can &amp; has been use‚Ä?https://t.co/Md2MJkcG4D"
3004665009,2017/11/14 23:13,[u'guncontrolnow'],1,1,Music Mondays,991,938,"Los Angeles, CA",8568,None,None,-2,There were 2 shooters...one dead the other terrorist on the loose! #guncontrolnow https://t.co/Zkk7lgio14
17070113,2017/11/14 23:01,[],7,35,Mayor Eric Garcetti,363,268338,"Los Angeles, CA",15241,None,None,0,Joining experts from around the world at @USC to talk about empowering our communities to protect against violent i‚Ä?https://t.co/IZpnEjIEaz
1733689704,2017/11/14 22:50,[],0,0,Dante J.,262,1108,"Los Angeles, CA",16474,None,None,-2,"@nbcbayarea At this point, who gives a fuck. Nothing is going to be done about it. If he‚Äôs White the same arguments‚Ä?https://t.co/3AyGJXlM0l"
619107295,2017/11/14 22:48,[],1,50,#flyeaglesfly,519,105,"Los Angeles, CA",6667,None,None,-2,@PaigeElizeb Who was radicalized in the United States much like all the white trash supremacists that have killed f‚Ä?https://t.co/mephfjVIvB
7.45E+17,2017/11/14 22:27,[],0,0,Melanie Anne,343,74,"Los Angeles, CA",1145,None,None,-2,@VP Provide federal support? Stop supporting the NRA u terrorist
156494773,2017/11/14 22:10,[],0,0,squeezebox,428,563,"Los Angeles, CA",14039,None,None,-2,@NuudesOverRudes no...men are literally destroying this planet and are terrorist and will call you a bitch if you d‚Ä?https://t.co/pA3l19pJDC
269032683,2017/11/14 21:53,[u'MAGA'],0,0,Jeremiah Schultz,14135,15580,"Los Angeles, CA",20385,None,None,-2,Cuba Awards ‚ÄòOrder of Solidarity‚Ä?to Puerto Rican Terrorist Freed by Obama #MAGA RETWEET &amp; FOLLOW https://t.co/0avBfh9Mar
17920055,2017/11/14 21:48,[],0,0,HWDRepublican,5478,6222,"Hollywood, CA USA",595901,None,None,-2,THR: Cuba Awards ‚ÄòOrder of Solidarity‚Ä?to Puerto Rican Terrorist Freed by Obama https://t.co/NPupG7KOeW (BB)
18653078,2017/11/14 21:26,[],155,763,Timothy Simons,911,83590,"Los Angeles, CA",1735,None,None,-2,The NRA is a terrorist organization.
