user_id,created_at,hashtags,retweet_count,favorite_count,user_name,user_friends_count,user_followers_count,user_location,user_tweet_count,place,geo,tweets
801595243661434880,2017-11-13 19:08:55,[],0,0,Jack Jones,707,459,"Los Angeles, CA",7823,None,None,"b'@politico See, if the tax ""reform"" contemplated by the GOP passes, Donald\'s estate will pass to his heirs without t\xe2\x80\xa6 https://t.co/63xwtOPP3X'"
18995147,2017-11-13 18:56:01,[],4,26,Ali Davis,1529,8150,Los Angeles,79210,None,None,"b""So excited that @realDonaldTrump is about to release his tax forms. There's no way he'd be too chicken to do that n\xe2\x80\xa6 https://t.co/Q9xrVIsEuj"""
148128790,2017-11-13 18:45:13,[],0,0,Steve Miller,183,98,"Los Angeles, California",2298,None,None,"b'@SenateGOP @SenatorBurr Finally, this just feels like a tax cut for billionaires... not REFORM. It is was reform, y\xe2\x80\xa6 https://t.co/Ew1h455MYZ'"
889267397097607172,2017-11-13 18:36:43,[],0,0,Nate,145,73,"Los Angeles, CA",743,None,None,b'@AngeloWarEagle @Carlos_Thomas @Deplorangel @marymac169 @KCSportsNerd @45Resign @DavidHueyLane1 @JebSanford\xe2\x80\xa6 https://t.co/bGpm51IBVF'
215082621,2017-11-13 18:35:06,[],0,0,exclusivelaestates,13,148,"Los Angeles, CA",2302,None,None,b'Thinking about buying? Then this is a must-read! https://t.co/SwYhcVAAzM'
215082621,2017-11-13 18:35:03,[],0,0,exclusivelaestates,13,148,"Los Angeles, CA",2302,None,None,b'Thinking about buying? Then this is a must-read!  https://t.co/RlpZpgyq82'
24061160,2017-11-13 18:33:52,[],0,0,Derik Van Derbeken,1493,224,City of the Angels,3471,"Place(_api=<tweepy.api.API object at 0x0000000007DAA940>, id='3b77caf94bfc81fe', url='https://api.twitter.com/1.1/geo/id/3b77caf94bfc81fe.json', place_type='city', name='Los Angeles', full_name='Los Angeles, CA', country_code='US', country='United States', contained_within=[], bounding_box=BoundingBox(_api=<tweepy.api.API object at 0x0000000007DAA940>, type='Polygon', coordinates=[[[-118.668404, 33.704538], [-118.155409, 33.704538], [-118.155409, 34.337041], [-118.668404, 34.337041]]]), attributes={})",None,"b'Reason #168 why proposed  GOP tax ""reform"" bill is a giant pile of cow pie, except for the poor Corporations &amp; sad\xe2\x80\xa6 https://t.co/nOVHIXnk9j'"
28832582,2017-11-13 18:26:06,[],0,0,Caro Krissman,1248,578,Los Angeles +,561,None,None,"b'The tax reform bill is a giant FU to CA and NY.\xc2\xa0\n\nWe all have heard or read it eliminates our state income tax deductions, ouch.\xc2\xa0\n\nToday I\xe2\x80\xa6'"
12707222,2017-11-13 18:24:17,['Outnum'],0,0,Annelize Bester,1686,1319,"Los Angeles, CA, U.S.A.",115372,None,None,b'FoxNews: .leezeldin on tax reform: \xe2\x80\x9cAll levels of government need to be working on delivering tax relief.\xe2\x80\x9d #Outnum\xe2\x80\xa6 https://t.co/hmzxYavs0k'
2451884694,2017-11-13 18:17:09,[],0,0,Maria S. Gutierrez,105,86,"Granada Hills, Ca",4401,None,None,b'How will Trump\xe2\x80\x99s tax reform proposals affect my homeownership plans? https://t.co/CvWi80jg01'
411337661,2017-11-13 18:14:37,[],0,0,Robert Hakim,114,39269,Los Angeles,217,None,None,"b""@realDonaldTrump Plz just focus on passing the tax reform by Christmas. Let's get to healthcare reform next year."""
316812462,2017-11-13 18:09:46,['trump'],1,0,Enrique Legaspi,415,460,"Los Angeles, CA",6882,None,None,"b""#trump's tax plan: Teacher cannot deduct pens and pencils for his classroom and Corporations can. If a business rel\xe2\x80\xa6 https://t.co/O7zpXUiCHI"""
58351787,2017-11-13 18:03:27,[],0,0,Allison Baker,1324,443,Studio City,28508,None,None,b'@IvankaTrump @trumps_feed @RepTomMacArthur @USTreasury @stevenmnuchin1 @realDonaldTrump Who the fuck are you to be\xe2\x80\xa6 https://t.co/XXgT3vvtLm'
236586634,2017-11-13 18:02:28,[],0,0,Brandon Johnson,353,19741,"Los Angeles, CA",11745,None,None,"b'The proposed tax reform is a serious concern for Los Angeles homebuyers and the future of the housing market. Again,\xe2\x80\xa6https://t.co/iHujdfdTxc'"
602307146,2017-11-13 18:02:16,[],0,0,Wisdom Insurance Ser,155,364,"Westlake Village, CA",1538,None,None,b'Killing ObamaCare\xe2\x80\x99s individual mandate can serve the cause of tax and health-care reform https://t.co/MUYoJaXLaN via @WSJOpinion'
1449910177,2017-11-13 17:54:22,[],0,0,"Kami L. Molin, CPA",11,106,"Simi Valley, California",1038,None,None,"b'Tax breaks for oil, wind, electric cars survive in Senate bill https://t.co/Rr1dWdpmKo'"
2384071,2017-11-13 17:51:54,[],38,62,Tim O'Reilly,1821,1988093,"Oakland, CA",43529,"Place(_api=<tweepy.api.API object at 0x0000000007DAA940>, id='3b77caf94bfc81fe', url='https://api.twitter.com/1.1/geo/id/3b77caf94bfc81fe.json', place_type='city', name='Los Angeles', full_name='Los Angeles, CA', country_code='US', country='United States', contained_within=[], bounding_box=BoundingBox(_api=<tweepy.api.API object at 0x0000000007DAA940>, type='Polygon', coordinates=[[[-118.668404, 33.704538], [-118.155409, 33.704538], [-118.155409, 34.337041], [-118.668404, 34.337041]]]), attributes={})",None,"b'The GOP has forgotten that their job is to serve the American people, not just rich donors. We do need tax reform.\xe2\x80\xa6 https://t.co/nlo9XZcXbZ'"
18099023,2017-11-13 17:48:54,[],2,0,Christopher Webb,569,1099,"Venice, CA",1927,"Place(_api=<tweepy.api.API object at 0x0000000007DAA940>, id='3b77caf94bfc81fe', url='https://api.twitter.com/1.1/geo/id/3b77caf94bfc81fe.json', place_type='city', name='Los Angeles', full_name='Los Angeles, CA', country_code='US', country='United States', contained_within=[], bounding_box=BoundingBox(_api=<tweepy.api.API object at 0x0000000007DAA940>, type='Polygon', coordinates=[[[-118.668404, 33.704538], [-118.155409, 33.704538], [-118.155409, 34.337041], [-118.668404, 34.337041]]]), attributes={})",None,b'This @fredwilson post is a MUST READ! The current draft of the Senate Tax Reform Bill will tax stock options and RS\xe2\x80\xa6 https://t.co/HJwZm44Ksj'
203269109,2017-11-13 17:35:19,[],3,1,Brendan Ranson-Walsh,237,148,"Los Angeles, CA",866,None,None,b'Great interview with Dan McQuade on \xe2\x80\x9cHow @AECOM is positioning itself to lead the next generation of infrastructure\xe2\x80\x9d\nhttps://t.co/H3BOlpOmIE'
17824838,2017-11-13 17:22:04,"['Trump', 'TaxReform', 'GOP', 'Reagan']",0,0,Sam F Park,383,439,"Los Angeles, CA",56334,None,None,b'#Trump #TaxReform Splitting the #GOP. It\xe2\x80\x99s Happened Before Under #Reagan https://t.co/2EqrbBuNog'
214638825,2017-11-13 17:18:27,[],0,0,"Jaswant Gill CPA, PC",280,238,"Beverly Hills, CA",1122,None,None,b'https://t.co/lNgBMgl0fC'
1449910177,2017-11-13 17:09:57,[],0,0,"Kami L. Molin, CPA",11,106,"Simi Valley, California",1038,None,None,b'2017 tax reform: Proposed individual tax changes in the Tax Cuts and Jobs Act https://t.co/NNKVSg0gp9'
1480090886,2017-11-13 17:06:50,[],0,0,"Brian T. Stoner, CPA",3236,3978,"Burbank, CA",8524,None,None,b'Senate tax bill cuts 401(k) catch-up funding for some workers https://t.co/a6L8TOa4Kp'
2967808004,2017-11-13 17:02:18,[],0,0,Brody,35,49,los angeles,40284,None,None,b'President Trump calls for GOP to repeal individual mandate as part of their tax effort https://t.co/twafc4xqfC https://t.co/NcjeCJYV7n'
65109514,2017-11-13 16:56:38,[],0,0,Global Issues Web,2419,141510,"Los Angeles, California, USA",447800,None,None,b'What Real Tax Reform Could Look Like https://t.co/DmKKrW4Ky8 https://t.co/QccctQYaIc'
17920055,2017-11-13 16:55:14,[],0,0,HWDRepublican,5481,6224,"Hollywood, CA USA",596052,None,None,b'GOP: .IvankaTrump: This deregulation philosophy coupled with tax reform is going to have an enormous impact on GDP\xe2\x80\xa6 https://t.co/pj5wbYRHqr'
124870074,2017-11-13 16:54:05,[],0,0,Victor Chavez,29,15,"Los Angeles, CA",24,None,None,b'Middle income earners will see little to not change in their taxes if  GOP tax reform passes. In the other hand cor\xe2\x80\xa6 https://t.co/XsZ6PpVv3y'
113738369,2017-11-13 16:41:03,[],0,0,London Aftr Midnight,65,3888,Los Angeles CA USA,4479,None,None,b'Republicans Say They\xe2\x80\x99ve Got Cut Taxes for the Rich\xe2\x80\x94or Donors Might Get Mad https://t.co/AFEGWe4Xvn'
2587768189,2017-11-13 16:40:25,[],0,1,Francisco Castro,1161,450,"Los Angeles, CA",16939,None,None,"b'@FoxNews @IvankaTrump Of course, Ivanka is pushing for ""Tax Reform"". The @POTUS/@GOP tax scam would end the Estate\xe2\x80\xa6 https://t.co/naGuzp0WHK'"
2291813732,2017-11-13 16:29:14,['Tax'],0,0,Dave Goodman,4822,2153,Los Angeles CA,1289,None,None,b'@IvankaTrump just confirmed she had taken on #Tax reform for kids as her personal fight! Wow! Who is buying that bu\xe2\x80\xa6 https://t.co/VoMbjCauZp'
22734933,2017-11-13 16:17:22,[],0,0,Tech News,8,40,Los Angeles,2755,None,None,"b'Current draft of Senate Tax Reform Bill would tax stock options and RSUs upon vesting, which would h https://t.co/Q39HWhpk5b'"
148128790,2017-11-13 16:14:02,[],1,1,Steve Miller,183,98,"Los Angeles, California",2298,None,None,"b""@CNNPolitics Don't call it Tax Reform.  It's a tax cut to benefit the 1% and does nothing to simplify the code or to make it fairer."""
17920055,2017-11-13 16:09:29,[],0,0,HWDRepublican,5481,6224,"Hollywood, CA USA",596052,None,None,b'THR: GOP nears initial victory on tax reform https://t.co/s08OVHnZsp (HL)'
144750173,2017-11-13 15:58:18,[],0,0,Debbie.Y,1775,1687,Los Angeles CALIFORNIA,17553,None,None,b'What Real Tax Reform Could Look Like https://t.co/vpuF8e7beW https://t.co/dO4loaDu6i'
840166008,2017-11-13 15:52:42,[],0,0,Scott Stanley Smith,444,835,West Hollywood CA,9807,None,None,b'Beware the fine print \xe2\x80\x94 a GOP tax cut for small businesses is more like a giveaway for the rich https://t.co/MpG0uV5dMa'
280884877,2017-11-13 15:45:04,[],0,0,James Auld,145,96,"Los Angeles, CA",2377,None,None,b'Beware the fine print \xe2\x80\x94 a GOP tax cut for small businesses is more like a giveaway for the rich https://t.co/RSe8Y2o5Cs'
239510568,2017-11-13 15:43:34,[],3,5,Thomas Bishop,5290,9564,Los Angeles,215024,None,None,b'Hill Republican dilemma: Dash to pass tax reform giveaway to the rich at your expense or face donor backlash - CNN https://t.co/p5PJrjFF2b'
815364772317184000,2017-11-13 15:42:02,[],2,4,Carl Hasting,807,620,"Los Angeles, CA",7900,None,None,b'Beware the fine print \xe2\x80\x94 a GOP tax cut for small businesses is more like a giveaway for the rich https://t.co/s6uW7YTsXM'
17920055,2017-11-13 15:39:35,[],0,0,HWDRepublican,5481,6224,"Hollywood, CA USA",596052,None,None,b'THR: Trump calls for individual mandate repeal before House vote on tax reform https://t.co/IptzBYNnPq (WE)'
384224028,2017-11-13 15:38:57,[],0,0,Adrian Leung,512,478,Palos Verdes Estates,11740,None,None,b'@realDonaldTrump Of course you are proud because you and the super rich will get a major tax cut! This tax reform p\xe2\x80\xa6 https://t.co/zmi1Ze8Y6T'
36471647,2017-11-13 15:31:58,[],0,1,Randy Frey,205,80,"Los Angeles, CA",2912,None,None,"b'@realDonaldTrump Your tax ""reform"" will raise my taxes considerably according to my accountant. Many other people I\xe2\x80\xa6 https://t.co/tWD4qCkJpp'"
65109514,2017-11-13 15:22:17,[],0,0,Global Issues Web,2419,141510,"Los Angeles, California, USA",447800,None,None,"b""Ivanka Trump's Clueless Defense of Tax Reform Almost Beggars Belief https://t.co/t8Z3steIvM https://t.co/ksHvVf0smL"""
713289770,2017-11-13 15:21:08,[],0,1,chuck brown,393,57,"Los Angeles,CA",1579,None,None,"b'@realDonaldTrump Your tax reform punishes post-secondary education in particular grad and post-grad school, a creat\xe2\x80\xa6 https://t.co/bisvggeBts'"
234945106,2017-11-13 15:17:40,[],1,1,Monte Harrick,6,54,Los Angeles,14,None,None,"b""It's time to make a grassroots effort to help remove potentially damaging legislation to personal retirement and sav\xe2\x80\xa6https://t.co/zKfrWtOe0y"""
858407531722547201,2017-11-13 15:01:10,[],3,5,Breaking News,6174,52906,"Los Angeles, CA",51164,"Place(_api=<tweepy.api.API object at 0x0000000007DAA940>, id='3b77caf94bfc81fe', url='https://api.twitter.com/1.1/geo/id/3b77caf94bfc81fe.json', place_type='city', name='Los Angeles', full_name='Los Angeles, CA', country_code='US', country='United States', contained_within=[], bounding_box=BoundingBox(_api=<tweepy.api.API object at 0x0000000007DAA940>, type='Polygon', coordinates=[[[-118.668404, 33.704538], [-118.155409, 33.704538], [-118.155409, 34.337041], [-118.668404, 34.337041]]]), attributes={})",None,b'.@IvankaTrump: Tax Reform Is Critical to Growing the Economy &amp; Helping the Middle Class https://t.co/fv1j2uMovy @newnewspage'
17825891,2017-11-13 15:00:57,[],0,0,L.A. Times Opinion,2156,15669,"Los Angeles, CA",28380,None,None,b'Beware the fine print \xe2\x80\x94 a GOP tax cut for small businesses is more like a giveaway for the rich.\xe2\x80\xa6 https://t.co/9LxHjKvSdL'
17955431,2017-11-13 14:58:34,[],0,0,FleederMae,4988,2784,"Encino ,Ca ",56432,None,None,b'@EndtheHIT @realDonaldTrump Democrats who fight against tax reform and tax breaks for working class will get bit in the butt!'
16664681,2017-11-13 14:55:15,[],55,37,Los Angeles Times,10665,3109932,"Los Angeles, CA",183548,None,None,b'Op-Ed: Beware the fine print \xe2\x80\x94 a GOP tax cut for small businesses is more like a giveaway for the rich\xe2\x80\xa6 https://t.co/s4aTLkhM1V'
65109514,2017-11-13 14:50:17,[],1,0,Global Issues Web,2419,141510,"Los Angeles, California, USA",447800,None,None,b'Beware the fine print \xe2\x80\x94 a GOP tax cut for small businesses is more like a giveaway for the rich\xe2\x80\xa6 https://t.co/ksRjLdGfQb'
421327684,2017-11-13 14:43:43,"['TaxReform', 'Congress']",0,0,US Opinion Research,630,69,"Los Angeles, CA",1238,None,None,b'Republicans Confident They Have Needed Votes for Tax Reform - Timothy Meads #TaxReform #Congress  https://t.co/NI4DigKdoc'
11462742,2017-11-13 14:39:23,[],0,0,BOB,4359,2261,LONDON AND LA,166937,None,None,b'Tax reform mess proves GOP is on a sinking ship https://t.co/b1PLaej7zR'
455835607,2017-11-13 14:31:27,[],0,0,Maureen Kris,255,226,Los Angeles,35847,None,None,b'Q is whether the people are prepared for the benefit of tax reform. Is private industry prepared?'
455835607,2017-11-13 14:30:40,[],0,0,Maureen Kris,255,226,Los Angeles,35847,None,None,b'Tax reform need be managed and led well to fruitful outcome and benefit...'
12707222,2017-11-13 13:49:24,[],0,0,Annelize Bester,1686,1319,"Los Angeles, CA, U.S.A.",115372,None,None,b'FoxNews: .IvankaTrump: Tax Reform Is Critical to Growing the Economy &amp; Helping the Middle Class https://t.co/8Kcn8CcFeA'
1215338797,2017-11-13 13:39:07,[],0,0,Gloria Suh,3405,1995,"Los Angeles, CA",10838,None,None,b'Stock futures lower as tax reform uncertainty weighs https://t.co/xUnYuqN9FM https://t.co/bRrXFtb3HN'
24051617,2017-11-13 13:11:07,[],0,0,Asian Girl W.T,1740,1711,"Los Angeles, CA",35133,None,None,b'Beware the fine print \xe2\x80\x94 a GOP tax cut for small businesses is more like a giveaway for the rich\xe2\x80\xa6 https://t.co/ubOrxGDsIL'
21328656,2017-11-13 13:11:03,[],0,0,Investors.com,361,126342,"Los Angeles, CA",70536,None,None,b'Tax Reform Talk Muddies Giving To Charity: What You Need To Know https://t.co/200SBi7wDg https://t.co/bNHzun483d'
2967808004,2017-11-13 13:07:06,[],0,0,Brody,35,49,los angeles,40284,None,None,b'The House of Representatives is expected to vote this week on a major tax reform bill https://t.co/ERz4xtOeEq https://t.co/iTWDFTdrEg'
1733245196,2017-11-13 13:05:02,[],0,0,William Mungall,198,393,"Los Angeles, CA",207832,None,None,b'Beware the fine print \xe2\x80\x94 a GOP tax cut for small businesses is more like a giveaway for the rich https://t.co/f4gPFiBsI3'
271146912,2017-11-13 12:49:43,[],0,0,STEVEN RESURRECTION,10966,12403,"Los Angeles, CA, United States",63118,None,None,"b'""Global stocks fall on U.S. tax reform doubts, May\'s woes hit sterling"" - https://t.co/XXI8TNzjDB'"
12707222,2017-11-13 12:44:17,[],0,0,Annelize Bester,1686,1319,"Los Angeles, CA, U.S.A.",115372,None,None,"b'FoxNews: .IvankaTrump: ""Tax reform is a critical component of our plan to invigorate the economy."" https://t.co/UXR6ayZi6w'"
73194083,2017-11-13 12:37:12,[],0,0,Maria Teresa Sarabia,1480,1558,"Los Angeles, California",81931,None,None,b'Congress week ahead: Key House vote on tax reform - CNN https://t.co/T40Reaierz'
2967808004,2017-11-13 11:57:22,[],0,0,Brody,35,49,los angeles,40284,None,None,b'The House of Representatives is expected to vote this week on a major tax reform bill https://t.co/d9lVRNkeiy https://t.co/SxKHb1OvqZ'
65109514,2017-11-13 11:27:15,[],1,0,Global Issues Web,2419,141510,"Los Angeles, California, USA",447800,None,None,b'The tax reform the US really needs https://t.co/SNN4YfNi3n https://t.co/BgLfOx67Rf'
17920055,2017-11-13 11:14:21,[],0,0,HWDRepublican,5481,6224,"Hollywood, CA USA",596052,None,None,b'THR: Pro-Trump group goes after House Republicans reluctant on tax reform https://t.co/tO7s1vdkyr (WE)'
12707222,2017-11-13 08:24:06,[],0,0,Annelize Bester,1686,1319,"Los Angeles, CA, U.S.A.",115372,None,None,"b""FoxNews: On Sunday, IvankaTrump announced that this coming week, she'd make a big push for tax reform. https://t.co/uBCgXpyzE3"""
12707222,2017-11-13 08:04:07,[],0,0,Annelize Bester,1686,1319,"Los Angeles, CA, U.S.A.",115372,None,None,"b'FoxNews: Gary Cohn: ""The electorate wants Washington to legislate. This is why we have to get tax reform done."" https://t.co/4U5A4Xf7lq'"
3242604384,2017-11-13 07:41:07,[],0,0,1 Los Angeles,225,3653,Los Angeles,38638,None,None,"b""Los Angeles News Search LA (Political Expert Talks About Trump's Trip To Asia, Tax Reform, Senate Hopeful ...)  -\xe2\x80\xa6 https://t.co/hBnWNe4xsa"""
40753040,2017-11-13 05:33:12,[],0,0,LarryS0053,1096,979,"Los Angeles, Ca",1891,None,None,b'Will congress pass tax reform in 2017?'
12707222,2017-11-13 05:24:05,[],0,0,Annelize Bester,1686,1319,"Los Angeles, CA, U.S.A.",115372,None,None,"b'FoxNews: .CLewandowski_ on tax reform: ""I have very little faith in the members of Congress and the US Senate to g\xe2\x80\xa6 https://t.co/fm3WZbws0m'"
12707222,2017-11-13 04:34:12,[],0,0,Annelize Bester,1686,1319,"Los Angeles, CA, U.S.A.",115372,None,None,"b""FoxNews: Earlier today, IvankaTrump announced that this coming week, she'd make a big push for tax reform. https://t.co/Ycuhj7hzAk"""
12707222,2017-11-13 04:34:11,[],0,0,Annelize Bester,1686,1319,"Los Angeles, CA, U.S.A.",115372,None,None,"b'FoxNews: Gary Cohn: ""The electorate wants Washington to legislate. This is why we have to get tax reform done."" https://t.co/NecvlDwpUn'"
2304224395,2017-11-13 03:30:02,[],0,1,Ray Duke,297,68,"Los Angeles, CA",2780,None,None,b'@IvankaTrump @USTreasury @stevenmnuchin1 @realDonaldTrump Nobody elected you. You wouldn\xe2\x80\x99t know tax reform if it bi\xe2\x80\xa6 https://t.co/k874FkqjGO'
12707222,2017-11-13 03:04:04,[],0,0,Annelize Bester,1686,1319,"Los Angeles, CA, U.S.A.",115372,None,None,b'FoxNews: TUESDAY: SpeakerRyan answers tax reform questions! BretBaier &amp; MarthaMacCallum host a special town hall a\xe2\x80\xa6 https://t.co/tiw4CGNX5G'
12707222,2017-11-13 02:44:05,[],0,0,Annelize Bester,1686,1319,"Los Angeles, CA, U.S.A.",115372,None,None,"b'FoxNews: .Richardafowler on tax reform: ""While [the Senate] is tinkering with these  numbers, they\'re hurting real\xe2\x80\xa6 https://t.co/ADRYv5XPnu'"
851526166100029442,2017-11-13 02:38:03,['NextRevFNC'],2,3,The Next Revolution,133,6695,"Los Angeles, CA",461,None,None,b'.@Richardafowler:\xe2\x80\x9cI think we should lower the corporate tax rate but tax reform takes time.\xe2\x80\x9d #NextRevFNC https://t.co/YM2ESX4d2C'
755466640838496257,2017-11-13 02:09:33,[],0,0,JMU Politico,74,63,"Los Angeles, CA",4726,None,None,"b""@shannonrwatts Is tax reform her passion project now? She's like fuck women's rights, fuck equal pay for women, fuc\xe2\x80\xa6 https://t.co/mGWPP8iAlC"""
47981899,2017-11-13 01:49:37,[],0,0,Sam Melehani,462,144,Los Angeles,474,None,None,b'Finance Committee Chairman Hatch releases Senate tax reform bill https://t.co/DEwocxZ5bX'
713289770,2017-11-13 01:16:56,[],0,0,chuck brown,393,57,"Los Angeles,CA",1579,None,None,"b""@CNNPolitics What kind of break. I know I'm grad school and it's projecting I'm screw under tax reform."""
1334661757,2017-11-13 00:39:55,[],0,1,Steven H. Alpert,63,16,"Beverly Hills, CA",642,None,None,b'@10peeps3 @cher Annie... we have to mobilize all Cher Fans to denounce GOP Tax Reform. This will not help middle cl\xe2\x80\xa6 https://t.co/ThvhBYv4vs'
924055858346016768,2017-11-13 00:29:15,[],0,0,ÌÆ¾ê,183,154,"Los Angeles, CA",1768,None,None,b'RT JonathonTrugman: Column: What Real Reform Would Look Like- Quit bickering over tax reform and unite for once https://t.co/LxV120jWDv vi\xe2\x80\xa6'
129332353,2017-11-13 00:17:30,[],0,0,Ron Robinson,3763,8670,"Los Angeles, CA",64660,None,None,b'Get ready for the tax reform fight of November-December - The big news this week has obviously been President D... https://t.co/wxu1qNzObq'
413595067,2017-11-12 23:45:58,[],0,1,John Blumenthal,815,963,Los Angeles,1019,None,None,"b'@GOP @senrobportman Well then maybe you and your fellow thieves should come up with a smart pro-growth tax reform bill, Rob.'"
12707222,2017-11-12 23:14:28,[],0,0,Annelize Bester,1686,1319,"Los Angeles, CA, U.S.A.",115372,None,None,"b'FoxNews: Gary Cohn: ""The electorate wants Washington to legislate. This is why we have to get tax reform done."" https://t.co/soh2tBTWEm'"
4103262253,2017-11-12 22:19:26,[],0,1,Turquoise T-Rex,337,133,,2221,"Place(_api=<tweepy.api.API object at 0x0000000007DAA940>, id='3b77caf94bfc81fe', url='https://api.twitter.com/1.1/geo/id/3b77caf94bfc81fe.json', place_type='city', name='Los Angeles', full_name='Los Angeles, CA', country_code='US', country='United States', contained_within=[], bounding_box=BoundingBox(_api=<tweepy.api.API object at 0x0000000007DAA940>, type='Polygon', coordinates=[[[-118.668404, 33.704538], [-118.155409, 33.704538], [-118.155409, 34.337041], [-118.668404, 34.337041]]]), attributes={})",None,"b'Why, exactly, do you need to be working with congress for tax reform? What exactly is your role in the government?\xe2\x80\xa6 https://t.co/yeQjMEyZCz'"
336818917,2017-11-12 21:56:30,[],0,0,Casey Coates Danson,366,416,Los Angeles,54120,None,None,"b""Republicans say they've got to act on tax reform\xe2\x80\x94or donors might get mad https://t.co/C5fOmjPG3D"""
336818917,2017-11-12 21:56:19,[],0,0,Casey Coates Danson,366,416,Los Angeles,54120,None,None,"b""Republicans say they've got to act on tax reform\xe2\x80\x94or donors might get mad https://t.co/waLQwa1bi8"""
331526337,2017-11-12 20:46:16,[],2,3,Leon Hollywood,60,136,"Hollywood, Los Angeles",214,None,None,"b'@FoxNews @IvankaTrump specifically, tax reform for handbags produced in cambodian sweatshops'"
710331231225794561,2017-11-12 20:34:25,[],0,0,Andysoso2016,709,771,"Los Angeles, CA",3367,None,None,"b""Expert says repealing Obamacare's mandate should be included in House and Senate tax reform proposals..\xe2\x80\xa6 https://t.co/NNdgWIhxuN"""
12707222,2017-11-12 20:34:14,[],0,0,Annelize Bester,1686,1319,"Los Angeles, CA, U.S.A.",115372,None,None,b'FoxNews: TUESDAY: SpeakerRyan answers tax reform questions! BretBaier &amp; MarthaMacCallum host a special town hall a\xe2\x80\xa6 https://t.co/pl9m9fNucK'
710331231225794561,2017-11-12 20:33:50,[],0,0,Andysoso2016,709,771,"Los Angeles, CA",3367,None,None,"b""Expert says repealing Obamacare's mandate should be included in House and Senate tax reform proposals.. https://t.co/VdyuaSPOWi"""
12707222,2017-11-12 20:24:14,[],0,0,Annelize Bester,1686,1319,"Los Angeles, CA, U.S.A.",115372,None,None,"b""FoxNews: Earlier today, IvankaTrump announced that this coming week, she'd make a big push for tax reform. https://t.co/66zTfy0imn"""
12707222,2017-11-12 20:14:08,[],0,0,Annelize Bester,1686,1319,"Los Angeles, CA, U.S.A.",115372,None,None,"b'FoxNews: .CLewandowski_ on tax reform: ""I have very little faith in the members of Congress and the US Senate to g\xe2\x80\xa6 https://t.co/ctPerQ9D1O'"
17072387,2017-11-12 19:51:46,[],0,4,gailborges,2685,2073,Los Angeles,54168,None,None,"b""Why are you even talking?! When the wealthy are pushing for tax cuts, not reform, clueless, we all know it's a bad\xe2\x80\xa6 https://t.co/PmEnEx69E3"""
12707222,2017-11-12 19:44:16,[],0,0,Annelize Bester,1686,1319,"Los Angeles, CA, U.S.A.",115372,None,None,b'FoxNews: WATCH: RepKevinBrady discusses tax reform on FoxNewsSunday. [Part 2] https://t.co/JORmmtNqG8'
12707222,2017-11-12 19:44:16,[],0,0,Annelize Bester,1686,1319,"Los Angeles, CA, U.S.A.",115372,None,None,b'FoxNews: WATCH: RepKevinBrady discusses tax reform on FoxNewsSunday. [Part 1] https://t.co/yzucuD0JrY'
2361946392,2017-11-12 19:11:59,[],0,0,Tom Dailey,472,176,"Los Angeles, California",3309,None,None,"b'@SpeakerRyan Speaker Ryan, please get back to me about tax reform once the 3 year old with nuclear weapons has been\xe2\x80\xa6 https://t.co/JgPjJzJ4t2'"
51491284,2017-11-12 19:04:54,[],0,0,Susan Davis,233,41,LA,1081,None,None,b'Don\xe2\x80\x99t Let Tax Reform Become A Tax Increase For Homeowners https://t.co/gtIxC2mukG'
1924634658,2017-11-12 18:51:57,[],0,0,TricellSoftware,20,8,"Los Angeles, CA",513,None,None,b'I like to see Democratcs  a bit more active and spreading the word a bit  more regarding GOP tax reform.'
